<?xml version="1.0" encoding="utf-8"?>
<data-map xmlns="http://cayenne.apache.org/schema/3.0/modelMap"
	 xmlns:xsi="http://www.w3.org/2001/XMLSchema-instance"
	 xsi:schemaLocation="http://cayenne.apache.org/schema/3.0/modelMap http://cayenne.apache.org/schema/3.0/modelMap.xsd"
	 project-version="6">
	<property name="defaultPackage" value="org.apache.cayenne.lifecycle.db"/>
	<db-entity name="E1">
		<db-attribute name="ID" type="BIGINT" isPrimaryKey="true" isMandatory="true"/>
	</db-entity>
	<db-entity name="E2">
		<db-attribute name="ID" type="BIGINT" isPrimaryKey="true" isMandatory="true"/>
	</db-entity>
	<db-entity name="SORT_DEP">
		<db-attribute name="ID" type="BIGINT" isPrimaryKey="true" isMandatory="true"/>
		<db-attribute name="ROOT_ID" type="BIGINT" isMandatory="true"/>
	</db-entity>
	<db-entity name="SORT_ROOT">
		<db-attribute name="ID" type="INTEGER" isPrimaryKey="true" isMandatory="true"/>
	</db-entity>
	<db-entity name="UUID_ROOT1">
		<db-attribute name="ID" type="INTEGER" isPrimaryKey="true" isMandatory="true"/>
		<db-attribute name="UUID" type="VARCHAR" length="200"/>
	</db-entity>
	<obj-entity name="E1" className="org.apache.cayenne.lifecycle.db.E1" dbEntityName="E1">
	</obj-entity>
	<obj-entity name="E2" className="org.apache.cayenne.lifecycle.db.E2" dbEntityName="E2">
	</obj-entity>
	<obj-entity name="SortDep" className="org.apache.cayenne.lifecycle.db.SortDep" dbEntityName="SORT_DEP">
	</obj-entity>
	<obj-entity name="SortRoot" className="org.apache.cayenne.lifecycle.db.SortRoot" dbEntityName="SORT_ROOT">
	</obj-entity>
	<obj-entity name="UuidRoot1" className="org.apache.cayenne.lifecycle.db.UuidRoot1" dbEntityName="UUID_ROOT1">
		<obj-attribute name="uuid" type="java.lang.String" db-attribute-path="UUID"/>
	</obj-entity>
	<db-relationship name="root" source="SORT_DEP" target="SORT_ROOT" toMany="false">
		<db-attribute-pair source="ROOT_ID" target="ID"/>
	</db-relationship>
	<db-relationship name="deps" source="SORT_ROOT" target="SORT_DEP" toMany="true">
		<db-attribute-pair source="ID" target="ROOT_ID"/>
	</db-relationship>
	<obj-relationship name="root" source="SortDep" target="SortRoot" deleteRule="Nullify" db-relationship-path="root"/>
	<obj-relationship name="deps" source="SortRoot" target="SortDep" deleteRule="Deny" db-relationship-path="deps"/>
</data-map>
