<?xml version="1.0" encoding="utf-8"?>
<data-map xmlns="http://cayenne.apache.org/schema/3.0/modelMap"
	 xmlns:xsi="http://www.w3.org/2001/XMLSchema-instance"
	 xsi:schemaLocation="http://cayenne.apache.org/schema/3.0/modelMap http://cayenne.apache.org/schema/3.0/modelMap.xsd"
	 project-version="6">
	<property name="defaultPackage" value="org.apache.cayenne.testdo.consttest"/>
	<db-entity name="CONST1_ENTITY">
		<db-attribute name="ID" type="BIGINT" isPrimaryKey="true" isMandatory="true"/>
		<db-attribute name="NAME" type="CHAR" isMandatory="true" length="200"/>
		<db-attribute name="STATUS" type="INTEGER" isMandatory="false"/>
		<db-attribute name="TYPE" type="INTEGER" isMandatory="true"/>
	</db-entity>
	<obj-entity name="Const1Entity" className="org.apache.cayenne.testdo.consttest.Const1Entity" dbEntityName="CONST1_ENTITY">
		<obj-attribute name="name" type="java.lang.String" db-attribute-path="NAME"/>
		<obj-attribute name="status" type="java.lang.Integer" db-attribute-path="STATUS"/>
		<obj-attribute name="type" type="org.apache.cayenne.testdo.consttest.Const1Type" db-attribute-path="TYPE"/>
	</obj-entity>
</data-map>
